name,scientific_name,short_description,what_is_it,what_does_it_do,who_is_it_good_for,who_should_avoid,url
Alpha-Glucan Oligosaccharide,,"Alpha-glucan oligosaccharide is in a class of prebiotic ingredients also found on ingredients lists as Fructooligosaccharides, lactobacillus extract filtrate, rhamnose and saccharomyces cerevisiae (yeast) extract. 

Prebiotics are a class of ingredients which can be found on ingredients lists as fructooligosaccharides, lactobacillus extract filtrate, rhamnose and saccharomyces cerevisiae (yeast) extract.","Prebiotics are a type of non-digestible dietary fiber used in skincare products to support the skin's microbiome, which consists of beneficial bacteria that contribute to skin health.","Prebiotics offer benefits such as:

- Help maintain a balanced and healthy skin microbiome by promoting the growth of beneficial bacteria.

- Support the skin's natural defences against harmful microorganisms, contributing to overall skin health.

- Enhance the skin's barrier function, reducing moisture loss and improving hydration.

- Can have a calming effect on the skin, helping to soothe and alleviate inflammation and irritation.","[' ', 'Acne', ' ', 'Blackheads', ' ', 'Redness', ' ', 'Pregnancy']","[' ', 'Related Allergy']",https://renude.co/ingredients/alpha-glucan-oligosaccharide
Aloe Vera,,"Aloe vera, also appear on ingredients lists as aloe barbadensis (aloe vera) leaf juice, contains around 75 active constituents, including Vitamins A,C & E to provide antioxidant protection, 8 enzymes to inhibit inflammatory processes in the body and 9 different minerals to support the body’s natural functioning. It also includes sugars to provide hydrating humectant properties, fatty acids to provide anti-inflammatory & antiseptic properties, and hormones to promote wound healing.","Aloe vera is a skincare ingredient derived from the gel-like substance found inside the leaves of the aloe vera plant. It is  used to soothe and hydrate the skin, and to promote overall skin health.","Aloe vera offers multiple benefits for the skin. It helps to soothe and calm irritated or sunburned skin, reducing redness and discomfort. Aloe vera also provides hydration and moisture, promoting a plump and healthy-looking complexion. Additionally, it contains antioxidants that help protect the skin against environmental damage and premature aging.","[' ', 'Dry and dehydrated skin', ' ', 'Impaired skin barrier', ' ', 'Radiance', ' ', 'Pregnancy', ' ', 'Texture']","[' ', 'Related Allergy']",https://renude.co/ingredients/aloe-vera
Allantoin,,"Allantoin occurs naturally in the body, but can also be derived from the root of the Comfrey plant or Chamomile, or produced synthetically. It is used in skincare for its ability to promote wound healing and healthy tissue growth, helping in the production of collagen and elastin fibres. Allantoin has also been shown to have soothing and anti-irritant properties, which is thought to be down to its ability to form complexes with irritating agents, thus preventing them from activating inflammatory mechanisms within the skin.","Allantoin is a skincare ingredient derived from plants such as comfrey root. It is known for its ability to soothe and calm the skin, making it a popular choice in skincare products.","Allantoin is a calming, anti-inflammatory, and hydrating ingredient which promotes wound healing by stimulating fibroblasts in the dermis.","[' ', 'Fine Lines', ' ', 'Impaired skin barrier', ' ', 'Redness', ' ', 'Pregnancy']","[' ', 'Related Allergy']",https://renude.co/ingredients/allantoin
Algin,,"Algin, also known as sodium alginate, is a large sugar molecule/polysaccharide that is used as a gelling agent in cosmetics, and is derived from brown seaweed. It is used in cosmetics for its hydrating and soothing properties, and in formulations as a binding and thickening agent.


It is in the class of Algae Extract which also include ahnfeltia concinna extract, alaria esculenta extract, algae exopolysaccharides, alteromonas ferment extract, ascophyllum nodosum extract, asparagopsis armata extract, chlorella protothecoides, chlorella vulgaris extract, dunaliella salina (green algae) extract, hydrolyzed f-fucoidan, laminaria ochroleuca (kelp) extract, macrocystis pyrifera (kelp) extract, and marine extract.","An extract from brown seaweed used as hydrating, soothing, and viscosity controlling agent.","In skincare products, it is used for its excellent water-binding properties to impart hydration and plumpness to the skin. In cosmetic product formulation, it is used as a thickening agent to improve the texture and viscosity of formulations.","[' ', 'Dry and dehydrated skin', ' ', 'Fine Lines', ' ', 'Pregnancy', ' ', 'Wrinkles']","[' ', 'Related Allergy']",https://renude.co/ingredients/algin
Algae Extract,,"It is essentially an underwater plant, designed to get its food from sunlight, much like any other plants, although from much more challenging conditions. In all its forms it acts as a powerful antioxidant, protecting from free radical damage, as well as being able to hydrate the skin and deliver naturally-occurring vitamins into the skin.

Algaes are a class of ingredients, many of which can be used in skincare. Variants of algae used in skincare are ahnfeltia concinna extract, alaria esculenta extract, algae exopolysaccharides, algin, alteromonas ferment extract, ascophyllum nodosum extract, asparagopsis armata extract, chlorella protothecoides, chlorella protothecoides oil (oleic acid), chlorella vulgaris extract, dunaliella salina (green algae) extract, hydrolysed algin, hydrolyzed f-fucoidan, laminaria ochroleuca (kelp) extract, laminaria ochroleuca extract. macrocystis pyrifera (kelp) extract, and marine extract","An incredibly interesting natural ingredient source, with some variability in properties depending on the specific source. It acts as powerful antioxidant and humectant/hydrator when used topically!","Algae extracts are multifunctional ingredients, providing hydrating, soothing, and antioxidant benefits. They also act as thickening and water-binding agents in formulations.","[' ', 'Dry and dehydrated skin', ' ', 'Fine Lines', ' ', 'Pregnancy', ' ', 'Wrinkles']","[' ', 'Related Allergy']",https://renude.co/ingredients/algae-extract
Algae Exopolysaccharides,,"Exopolysaccharides (EPS) are phytochemicals produced by Algae to protect from external stressors: UV radiation, oxidation (from free radicals) and temperature, so these provide skin-protecting benefits in skincare. Being a polysaccharide, this also offers humectant qualities, meaning it can draw water to it, plumping & hydrating the area it is applied to.


It is in the class of Algae Extract which also include ahnfeltia concinna extract, alaria esculenta extract, algae extract, algin, alteromonas ferment extract, ascophyllum nodosum extract, asparagopsis armata extract, chlorella protothecoides, chlorella vulgaris extract, dunaliella salina (green algae) extract, hydrolyzed f-fucoidan, laminaria ochroleuca (kelp) extract, macrocystis pyrifera (kelp) extract, and marine extract.","EPSs are macromolecular polysaccharidic compounds that are produced by algae to protect from UV, free radical damage and temperature.","In skincare, they are are used to protect from external stressors such as UV and free radicals, as well as provide hydration due to their humectant structure.","[' ', 'Dry and dehydrated skin', ' ', 'Fine Lines', ' ', 'Pregnancy', ' ', 'Wrinkles']","[' ', 'Related Allergy']",https://renude.co/ingredients/algae-exopolysaccharides
Alaria Esculenta Extract,,"A type of edible brown algae, harvested from waters bordering Europe and Ireland, and 
rich in amino acids, minerals and antioxidants. When used in skin care, it hydrates, 
soothes, and imparts the appearance and feel of firmness in the skin. The combined 
properties of the ingredient results in plump and hydrated skin, and reduced signs 
of ageing.


It is in the class of Algae Extract which also include ahnfeltia concinna extract, algae exopolysaccharides, algae extract, algin, alteromonas ferment extract, ascophyllum nodosum extract, asparagopsis armata extract, chlorella protothecoides, chlorella vulgaris extract, dunaliella salina (green algae) extract, hydrolyzed f-fucoidan, laminaria ochroleuca (kelp) extract, macrocystis pyrifera (kelp) extract, and marine extract.","A type of edible brown algae composed of amino acids, minerals (such as zinc, iron, selenium etc), and antioxidant.","Provides soothing, hydrating, firming and antioxidant benefits.","[' ', 'Dry and dehydrated skin', ' ', 'Fine Lines', ' ', 'Pregnancy', ' ', 'Wrinkles']","[' ', 'Related Allergy']",https://renude.co/ingredients/alaria-esculenta-extract
Alanine,,"Amino acids like Alanine are the small building blocks that make up peptides, and proteins.

Alanine is part of a class of Amino Acids. They can also be found on ingredients lists as acetyl glucosamine, acetyl tyrosinamide, arginine, arginine hcl, arginine pca, glycine, histidine, isoleucine, lysine, phenylalanine, proline, serine, taurine, threonine and valine and yeast amino acids.
","Alanine is present in the ""natural moisturising factors (NMFs)"" which moisturise and hydrate the skin. ",It can help to support water transport between skin cells to keep our surface smooth and hydrated.,"[' ', 'Dry and dehydrated skin', ' ', 'Pregnancy', ' ', 'Texture']","[' ', 'Related Allergy']",https://renude.co/ingredients/alanine
Ahnfeltia Concinna Extract,,"Ahnfeltia concinna extract, or red marine algae extract, is an algae which provides skin soothing and antioxidant properties for the skin. Being a polysaccharide, it is also an excellent thickener when used in formulations a has great humectant properties, able to draw and bind water to the areas it is applied.

It is in the class of Algae Extract which also include, alaria esculenta extract, algae exopolysaccharides, algae extract, algin, alteromonas ferment extract, ascophyllum nodosum extract, asparagopsis armata extract, chlorella protothecoides, chlorella vulgaris extract, dunaliella salina (green algae) extract, hydrolyzed f-fucoidan, laminaria ochroleuca (kelp) extract, macrocystis pyrifera (kelp) extract, and marine extract.",A natural extract from red marine algae with multifunctional properties.,"Provides soothing and antioxidant products to the skin, and increases the viscosity of formulations.","[' ', 'Dry and dehydrated skin', ' ', 'Fine Lines', ' ', 'Pregnancy', ' ', 'Wrinkles']","[' ', 'Related Allergy']",https://renude.co/ingredients/ahnfeltia-concinna-extract
Adenosine,,"Adenosine is a well-researched anti-ageing and soothing ingredient. It is produced naturally in the body, but can also be derived from yeast. It works by stimulating the skin's own collagen production process, to reduce the appearance of wrinkles. It also has anti-inflammatory and barrier repair benefits, so is a fantastic multi-functional skincare ingredient.","Adenosine is a skincare ingredient derived from yeast or produced synthetically. It is known for its ability to improve various signs of aging and promote smoother, more youthful-looking skin.","Provides soothing and skin-restoring properties, and studies indicate potential for anti-ageing and wrinkle improvement.","[' ', 'Acne', ' ', 'Dry and dehydrated skin', ' ', 'Elasticity', ' ', 'Fine Lines', ' ', 'Impaired skin barrier', ' ', 'Redness', ' ', 'Pregnancy', ' ', 'Wrinkles']","[' ', 'Related Allergy']",https://renude.co/ingredients/adenosine
Acetyl Tyrosinamide,,"Acetyl tyrosinamide is an effective moisturising ingredient that also has been shown to be effective in evening out the skin tone and reducing hyperpigmentation.

Amino acids are a class of ingredients. They can also be found on ingredients lists as acetyl glucosamine, alanine, arginine, arginine hcl, arginine pca, glycine, histidine, isoleucine, lysine, phenylalanine, proline, serine, taurine, threonine and valine and yeast amino acids.","N-Acetyl L-Tyrosinamide is present in the ""natural moisturising factors (NMFs)"" which moisturise and hydrate the skin. ",Acetyl Tyrosinamide is used in skincare to treat fine lines and wrinkles and support the skin's elasticity.,"[' ', 'Elasticity', ' ', 'Fine Lines', ' ', 'Wrinkles']","[' ', 'Related Allergy']",https://renude.co/ingredients/acetyl-tyrosinamide
Acetyl Tetrapeptide,,"Acetyl tetrapeptide is a string of peptides used in skincare products to reduce the appearance of wrinkles brought on by repeated facial expressions.

It is in a class of ingredients also found on ingredients lists as acetylarginyltryptophyl diphenylglycine, acetyl tetrapeptide, arginine/lysine polypeptide, azelaoyl bis-dipeptide, copper heptapeptide-14 pantothenate, dipeptide, dipeptide diaminobutyroyl benzylamide diacetate, ferric hexapeptide, heptapeptide-15, palmitate, myristol hexapeptide, myristol pentapeptide, myristoyl nonapeptide, myristoyl pentapeptide, oligopeptide, palmitoyl  tripeptide, palmitoyl decapeptide, palmitoyl heptapeptide, palmitoyl hexapeptide, palmitoyl nonapeptide, palmitoyl oligopeptide, palmitoyl pentapeptide, palmitoyl tetrapeptide, palmitoyl tripeptide, palmitoyl tetrapeptide, pentapeptide, sh-oligopeptide, tetrapeptide and copper palmitoyl heptapeptide. 
 ","Many peptides function as anti-ageing ingredients in skincare, due to their ability to fit specific receptors in the body to trigger anti-ageing responses. This includes mechanisms like collagen production, cell regeneration or even blocking muscle contractions to smooth expression lines.","Acetyl Tetrapeptide is used in skincare to treat fine lines, wrinkles and improve the skin's elasticity.","[' ', 'Elasticity', ' ', 'Fine Lines', ' ', 'Pregnancy', ' ', 'Wrinkles']","[' ', 'Related Allergy']",https://renude.co/ingredients/acetyl-tetrapeptide
Acetyl Glucosamine,,"Acetyl Glucosamine is an amino acid sugar. It increases hyaluronic acid production in the skin, repairs sun damage, improves skin tone & hydration, and reduces the appearance of wrinkles.

Amino acids are a class of ingredients. They can also be found on ingredients lists as acetyl tyrosinamide, alanine, arginine, arginine hcl, arginine pca, glycine, histidine, isoleucine, lysine, phenylalanine, proline, serine, taurine, threonine and valine and yeast amino acids.","Acetyl Glucosamine is an amino acid sugar.  In the skin, it is present in the ""natural moisturising factors (NMFs)"" which moisturise and hydrate the skin.","Acetyl Glucosamine is used in skincare to treat red and sensitive skin with hyperpigmentation, and for those who are looking to treat fine lines and wrinkles.","[' ', 'Dry and dehydrated skin', ' ', 'Elasticity', ' ', 'Fine Lines', ' ', 'Pigmentation', ' ', 'Redness', ' ', 'Texture', ' ', 'Wrinkles']","[' ', 'Related Allergy']",https://renude.co/ingredients/acetyl-glucosamine
Acetylarginyltryptophyl Diphenylglycine,,"Acetylarginyltryptophyl Diphenylglycine is a synthetic tetrapeptide used in skincare for its firming abilities. It works by inhibiting the enzyme elastase, which breaks down elastin in the skin (the protein responsible for skin firmness and elasticity). This reduction in elastase allows for higher levels of elastin in the skin, which in turn leads to skin that looks firmer, tighter and restructured.

It is in a class of ingredients also found on ingredients lists as acetyl hexapeptide, acetyl tetrapeptide, arginine/lysine polypeptide, azelaoyl bis-dipeptide, copper heptapeptide-14 pantothenate, dipeptide, dipeptide diaminobutyroyl benzylamide diacetate, ferric hexapeptide, heptapeptide-15, palmitate, myristol hexapeptide, myristol pentapeptide, myristoyl nonapeptide, myristoyl pentapeptide, oligopeptide, palmitoyl  tripeptide, palmitoyl decapeptide, palmitoyl heptapeptide, palmitoyl hexapeptide, palmitoyl nonapeptide, palmitoyl oligopeptide, palmitoyl pentapeptide, palmitoyl tetrapeptide, palmitoyl tripeptide, palmitoyl tetrapeptide, pentapeptide, sh-oligopeptide, tetrapeptide and copper palmitoyl heptapeptide.","Many peptides function as anti-ageing ingredients in skincare, due to their ability to fit specific receptors in the body to trigger anti-ageing responses. This includes mechanisms like collagen production, cell regeneration or even blocking muscle contractions to smooth expression lines.","Acetylarginyltryptophyl Diphenylglycine  is used in skincare to treat fine lines, wrinkles and improve the skin's elasticity.","[' ', 'Elasticity', ' ', 'Fine Lines', ' ', 'Pregnancy', ' ', 'Wrinkles']","[' ', 'Related Allergy']",https://renude.co/ingredients/acetylarginyltryptophyl-diphenylglycine
Acai Extract,,"Acai is a plant ingredient which can also be referred to by its botanical name,  euterpe oleracea. It displays potent antioxidant abilities, meaning it is able to protect skin against free radical damage.","An extract from the acai berry, used for its potent antioxidant benefits to target and prevent signs of UV and free radical damage.","Provide antioxidant benefits to the skin, fighting free radical damage and preventing premature ageing from the damage.","[' ', 'Pregnancy']","[' ', 'Related Allergy']",https://renude.co/ingredients/acai-extract
Ascorbic Acid,,"Part of the Vitamin C family of ingredients, L-ascorbic acid is Vitamin C in its purest form, and the active form required by the body to result in the many skin skin benefits of Vitamin C. The issue with L-ascorbic acid is in the delivery, as it is very unstable in water, and needs a pH 4 or below for it to penetrate the skin. That being said, when it can be stabilised in a formula and is able to penetrate the skin, it provides the highest potency of any form of Vitamin C currently available.

Vitamin C can also be found on ingredients lists as ascorbyl glucoside, ascorbyl palmitate, ethyl ascorbic acid, l-ascorbic acid, magnesium ascorbyl phosphate, sodium ascorbyl phosphate and tetrahexyldecyl ascorbate.",A potent and multifunctional superstar skincare ingredient with decades of research behind it!,"Ascorbic acid is a powerhouse ingredient with evidence for collagen synthesis so can help make the skin firmer, helps with hyperpigmentation, dark spots, and uneven skin tone and is great for preventing damage from the sun by neutralising free radicals.

Since ascorbic acid is already in the active form needed by the skin, no conversion is necessary, and if stabilised is highly potent.","[' ', 'Elasticity', ' ', 'Fine Lines', ' ', 'Pigmentation', ' ', 'Radiance', ' ', 'Pregnancy', ' ', 'Wrinkles']","[' ', 'Related Allergy', ' ', 'Sensitive', ' ', 'Dry Dehydrated', ' ', 'Impaired skin barrier']",https://renude.co/ingredients/ascorbic-acid
Ascophyllum Nodosum Extract,,"Ascophyllum nodosum extract is a type of cold water brown seaweed that has antioxidant properties and serves as a texture enhancer in cosmetics. It is found along the shorelines in cold areas of the world, such as Northern Canada and Iceland.

It is in the class of Algae Extract which also include ahnfeltia concinna extract, alaria esculenta extract, algae exopolysaccharides, algin, alteromonas ferment extract, alteromonas ferment extract, asparagopsis armata extract, chlorella protothecoides, chlorella vulgaris extract, dunaliella salina (green algae) extract, hydrolyzed f-fucoidan, laminaria ochroleuca (kelp) extract, macrocystis pyrifera (kelp) extract, marine extract, padina pavonica thallus extract, parachlorella beijerinckii exopolysaccharides, plankton extract, porphyridium cruentum extract, pseudoalteromonas exopolysaccharides, tripleurospermum maritimum extract, vibrio alginolyticus ferment filtrate, chlorella protothecoides oil",An extract of the seaweed/algae plant and is used in cosmetic products.,Can help attract water to the upper layer of the skin and might have some antioxidant effect,"[' ', 'Dry and dehydrated skin', ' ', 'Fine Lines', ' ', 'Pregnancy', ' ', 'Wrinkles']","[' ', 'Related Allergy']",https://renude.co/ingredients/ascophyllum-nodosum-extract
Arginine PCA,,"Arginine is an amino acid that can be found in food sources such as almonds and chocolate. Arginine is an essential amino acid that the body cannot produce on its own. It is often referred to as the ‘master amino acid’ and has a number of benefits to skin health.

Amino acids are a class of ingredients. They can also be found on ingredients lists as acetyl glucosamine, acetyl tyrosinamide, alanine,  arginine hcl, arginine pca, glycine, histidine, isoleucine, lysine, phenylalanine, proline, serine, taurine, threonine and valine and yeast amino acids.","Arginine PCA is present in the ""natural moisturising factors"" (NMFs) which moisturise and hydrate the skin.","Helps to protect the skin from free radicals, improve the appearance of hydration, and support collagen production.","[' ', 'Dry and dehydrated skin', ' ', 'Pregnancy', ' ', 'Texture']","[' ', 'Related Allergy']",https://renude.co/ingredients/arginine-pca
Arginine/Lysine Polypeptide,,"Arginine/lysine polypeptide is a skin care ingredient that slows down aging processes in the skin and boosts regeneration.

It is in a class of ingredients also found on ingredients lists as acetyl hexapeptide, acetyl tetrapeptide, acetylarginyltryptophyl diphenylglycine, azelaoyl bis-dipeptide, copper heptapeptide-14 pantothenate, dipeptide, dipeptide diaminobutyroyl benzylamide diacetate, ferric hexapeptide, heptapeptide-15, palmitate, myristol hexapeptide, myristol pentapeptide, myristoyl nonapeptide, myristoyl pentapeptide, oligopeptide, palmitoyl  tripeptide, palmitoyl decapeptide, palmitoyl heptapeptide, palmitoyl hexapeptide, palmitoyl nonapeptide, palmitoyl oligopeptide, palmitoyl pentapeptide, palmitoyl tetrapeptide, palmitoyl tripeptide, palmitoyl tetrapeptide, pentapeptide, sh-oligopeptide, tetrapeptide and copper palmitoyl heptapeptide.","Many peptides function as anti-ageing ingredients in skincare, due to their ability to fit specific receptors in the body to trigger anti-ageing responses. This includes mechanisms like collagen production, cell regeneration or even blocking muscle contractions to smooth expression lines.",Helps to preserve the skin’s natural collagen and elastin by offsetting substances within skin that cause both to degrade over time.,"[' ', 'Elasticity', ' ', 'Fine Lines', ' ', 'Pregnancy', ' ', 'Wrinkles']","[' ', 'Related Allergy']",https://renude.co/ingredients/arginine-lysine-polypeptide
Arginine HCL,,"Arginine is an amino acid that can be found in food sources such as almonds and chocolate. Arginine is an essential amino acid that the body cannot produce on its own. It is often referred to as the ‘master amino acid’ and has a number of benefits to skin health.

Amino acids are a class of ingredients. They can also be found on ingredients lists as acetyl glucosamine, acetyl tyrosinamide, alanine,  arginine hcl, arginine pca, glycine, histidine, isoleucine, lysine, phenylalanine, proline, serine, taurine, threonine and valine and yeast amino acids.","Arginine HCL is present in the ""natural moisturising factors (NMFs)"" which moisturise and hydrate the skin.","Helps to protect the skin from free radicals, improve the appearance of hydration, and support collagen production.","[' ', 'Dry and dehydrated skin', ' ', 'Pregnancy', ' ', 'Texture']","[' ', 'Related Allergy']",https://renude.co/ingredients/arginine-hcl
Arginine,,"Arginine is an amino acid that can be found in food sources such as almonds and chocolate. Arginine is an essential amino acid that the body cannot produce on its own. It is often referred to as the ‘master amino acid’ and has a number of benefits to skin health.

Amino acids are a class of ingredients. They can also be found on ingredients lists as acetyl glucosamine, acetyl tyrosinamide, alanine,  arginine hcl, arginine pca, glycine, histidine, isoleucine, lysine, phenylalanine, proline, serine, taurine, threonine and valine and yeast amino acids.","Arginine is present in the ""natural moisturising factors (NMFs)"" which moisturise and hydrate the skin.","Great for dry and Dehydrated skin, Arginine is an antioxidant with helps smooth the surface of our skin and treats fine lines.","[' ', 'Dry and dehydrated skin', ' ', 'Fine Lines', ' ', 'Pregnancy', ' ', 'Texture']","[' ', 'Related Allergy']",https://renude.co/ingredients/arginine
Argan Oil,,"Argan oil is derived from the nut of the Argan tree which grows in Morocco, it is naturally high in Vitamin E and fatty acids, which work to nourish the skin, protect the natural lipid barrier and provide antioxidant protection against free radicals.","Argan oil is extracted from the kernels of the argan tree fruit. It is rich in essential fatty acids, antioxidants, and vitamins, including vitamin E, which contribute to its beneficial effects on the skin.","Argan oil offers multiple benefits for the skin. It helps to moisturise and soften the skin, protect the skin against environmental damage and soothes and calms the skin.","[' ', 'Dry and dehydrated skin', ' ', 'Radiance', ' ', 'Pregnancy', ' ', 'Texture']","[' ', 'Related Allergy', ' ', 'Oily']",https://renude.co/ingredients/argan-oil
