name,scientific_name,short_description,what_is_it,what_does_it_do,who_is_it_good_for,who_should_avoid,url
Phytosphingosine,,"Phytosphingosine (PS) is a lipid which naturally occurs in the stratum corneum (the top, visible layer of our epidermis). This acts as a precursor for ceramide synthesis, meaning it encourages the skin to produce ceramides naturally.

Studies have also shown PS to offer anti-acne benefits, it is believed by reinforcing the protective barrier, and therefore reducing specific abnormalities in the skin functioning that lead to acne (invading inflammatory bacteria, increased keratinization, increased sebaceous gland activity). It is in the same class of essential lipids that include caprooyl phytosphingosine, caprooyl sphingosine, cholesterol, glycolipids, glycoproteins, glycosphingolipids, lecithin, linoleic acid, linolenic acid, and phospholipids.","Essential lipids, also known as skin-identical lipids, are a group of natural fats (lipids) found in the outermost layer of the skin. They play a crucial role in maintaining the skin's barrier function and overall health.","Essential lipids offer benefits such as:
- Help strengthen the skin's natural barrier, improving its ability to retain moisture and nutrients.
- Support skin cell cohesion, promoting a smooth and even skin texture.
- Protect the skin from external irritants, pollutants, and allergens.
- Contribute to the skin's resilience and overall health, helping to prevent dryness and sensitivity.","[' ', 'Dry and dehydrated skin', ' ', 'Impaired skin barrier', ' ', 'Radiance', ' ', 'Pregnancy', ' ', 'Texture']","[' ', 'Related Allergy']",https://renude.co/ingredients/phytosphingosine
Phospholipids,,"Phospholipids are comprising of fatty acids, glycerol & phosphate. They are in the class of essential lipids, and can be found on ingredient lists as caprooyl phytosphingosine, caprooyl sphingosine, cholesterol, glycolipids, glycoproteins, glycosphingolipids, Lecithin, linolenic acid, linolenic acid and phytosphingosine.","Essential lipids, also known as skin-identical lipids, are a group of natural fats (lipids) found in the outermost layer of the skin. They play a crucial role in maintaining the skin's barrier function and overall health.","Essential lipids offer benefits such as:
- Help strengthen the skin's natural barrier, improving It's ability to retain moisture and nutrients.
- Support skin cell cohesion, promoting a smooth and even skin texture.
- Protect the skin from external irritants, pollutants, and allergens.
- Contribute to the skin's resilience and overall health, helping to prevent dryness and sensitivity.","[' ', 'Dry and dehydrated skin', ' ', 'Impaired skin barrier', ' ', 'Radiance', ' ', 'Pregnancy', ' ', 'Texture']","[' ', 'Related Allergy']",https://renude.co/ingredients/phospholipids
Palmitoyl  Tripeptide-1,,"Palmitoyl tripeptide-1 is a synthetic fatty acid-linked peptide that can help repair visible skin damage and strengthen skin’s underlying supportive elements.

It is from a class of ingredients also found on ingredients lists as acetyl hexapeptide, acetyl tetrapeptide, acetylarginyltryptophyl diphenylglycine, arginine/lysine polypeptide, azelaoyl bis-dipeptide, copper heptapeptide-14 pantothenate, dipeptide, dipeptide diaminobutyroyl benzylamide diacetate, ferric hexapeptide, heptapeptide-15, palmitate, myristol hexapeptide, myristol pentapeptide, myristoyl nonapeptide, myristoyl pentapeptide, oligopeptide, palmitoyl  tripeptide, palmitoyl decapeptide, palmitoyl heptapeptide, palmitoyl nonapeptide, palmitoyl oligopeptide, palmitoyl pentapeptide, palmitoyl tetrapeptide, pentapeptide, sh-oligopeptide, tetrapeptide and copper palmitoyl heptapeptide.","Many peptides function as anti-ageing ingredients in skincare, due to their ability to fit specific receptors in the body to trigger anti-ageing responses. This includes mechanisms like collagen production, cell regeneration or even blocking muscle contractions to smooth expression lines.","Used in skincare to treat fine lines, wrinkles and improve the skin's elasticity.","[' ', 'Elasticity', ' ', 'Fine Lines', ' ', 'Pregnancy', ' ', 'Wrinkles']","[' ', 'Related Allergy']",https://renude.co/ingredients/palmitoyl-tripeptide-1
Pentapeptide,,"Pentapeptide is a biomimetic peptide that helps the skin become less sensitive by neutralising signals in skin's uppermost layers that would otherwise appear as signs of sensitivity.  In order to deliver this peptide to skin and keep it stable during use, it's typically paired with emollient fatty acids such as shea butter or lecithin.","A biomimetic (a synthetic ingredient that mimics the processes of a natural ingredient) peptide that contains the amino acids arginine, histidine, phenylalanine and valine.","On the skin, it has been shown to reduce signs of sensitisation, including visibly reducing redness.","[' ', 'Elasticity', ' ', 'Fine Lines', ' ', 'Pregnancy', ' ', 'Wrinkles']","[' ', 'Related Allergy']",https://renude.co/ingredients/pentapeptide
Palmitoyl Tetrapeptide,,"Palmitoyl tetrapeptide is a synthetic peptide composed of the amino acids glutamine, glycine, arginine, and proline. Along with the four amino acids, this peptide also contains the fatty acid palmitic acid to enhance stability and penetration into the skin.","A synthetic peptide composed of the amino acids glutamine, glycine, arginine, and proline.",It works as a skin-restoring ingredient and is noted for its soothing ability since it can interrupt factors within skin that lead to signs of irritation (including from exposure to UVB light) and loss of firmness.,"[' ', 'Elasticity', ' ', 'Fine Lines', ' ', 'Pregnancy', ' ', 'Wrinkles']","[' ', 'Related Allergy']",https://renude.co/ingredients/palmitoyl-tetrapeptide
Parachlorella Beijerinckii Exopolysaccharides,,"Parachlorella Beijerinckii Exopolysaccharides is an effective in anti-aging and a skin tone evening ingredient, that encourage elastin synthesis and cell regeneration.

It is in the class of Algae Extract which also include ahnfeltia concinna extract, alaria esculenta extract, algae exopolysaccharides, algin, alteromonas ferment extract, ascophyllum nodosum extract, asparagopsis armata extract, chlorella protothecoides, chlorella vulgaris extract, dunaliella salina (green algae) extract, hydrolyzed f-fucoidan, laminaria ochroleuca (kelp) extract, macrocystis pyrifera (kelp) extract, marine extract, padina pavonica thallus extract, plankton extract, porphyridium cruentum extract, pseudoalteromonas exopolysaccharides, tripleurospermum maritimum extract, vibrio alginolyticus ferment filtrate, chlorella protothecoides oil",An ingredient used in skincare as an effective in anti-aging and a skin tone evening ingredient,"It promotes elasticity in the skin, and cell regeneration. It hydrates the skin and is a great antioxidant to protect against free radicals and pollutants.","[' ', 'Dry and dehydrated skin', ' ', 'Fine Lines', ' ', 'Pregnancy', ' ', 'Wrinkles']","[' ', 'Related Allergy']",https://renude.co/ingredients/parachlorella-beijerinckii-exopolysaccharides
Retinyl Retinoate,,"Retinyl retinoate is a part of the vitamin A family of ingredients, which combines retinol with retinoic acid. Research shows that this makes it more stable in the delivery (a common problem with either active alone), as well as more potent and less irritating. It is broken down by the body in two stages - first into retinol and retinoic acid, then the retinol is broken down again into retinoic acid, so essentially packing double the punch. Studies carried out comparing this to pure retinol showed significantly more effective and faster results, with comparable side effects. 

It is part of a family of ingredients also found on ingredients lists as encapsulated retinaldehyde, hydroxypinacolone retinoate, retinaldehyde, retinyl palmitate and retinyl propionate.","An ester of retinol and retinoic acid, designed to improve stability, potency, and skin tolerability. Compared to retinol, it is significantly more effective with faster results, but with comparable side effects.","This ingredient is an antioxidant that stimulates collagen production, treating fine lines, wrinkles and a reduction of elasticity in the skin which can naturally come with aging.  It exfoliates the skin, unclogging  pores, helping treat acne and blemishes and improving the overall appearance of the skin making it smooth and supple.","[' ', 'Acne', ' ', 'Blackheads', ' ', 'Elasticity', ' ', 'Enlarged Pores', ' ', 'Fine Lines', ' ', 'Pigmentation', ' ', 'Radiance', ' ', 'Texture', ' ', 'Wrinkles']","[' ', 'Related Allergy', ' ', 'Pregnancy', ' ', 'Sensitive', ' ', 'Impaired skin barrier']",https://renude.co/ingredients/retinyl-retinoate-8x-more-powerful-than-retinol
Palmitoyl Tripeptide,,"Categorized as a “messenger peptide” because of its ability to “tell” skin how to look better, specifically regarding reducing signs of sun damage like wrinkles and rough texture. Some research has shown that palmitoyl tripeptide has similar anti-aging benefits to retinol.",A synthetic fatty acid-linked peptide that can help repair visible skin damage and strengthen skin’s underlying supportive elements.,Helps strengthen skin’s underlying supportive elements. Backed by research for minimizing the appearance of wrinkles.,"[' ', 'Elasticity', ' ', 'Fine Lines', ' ', 'Pregnancy', ' ', 'Wrinkles']","[' ', 'Related Allergy']",https://renude.co/ingredients/palmitoyl-tripeptide
Neurophroline,,"An incredibly innovative ingredient, Neurophroline is derived from the Wild Indigo plant and has multiple skin benefits. It has been shown to breakdown cortisol, a stress hormone which has many negative effects on the skin. It also triggers the release of a calming neuropeptide to reduce stress in the skin. Through these mechanisms, it has been shown to achieve a visible improvement in skin tone in as little as 2 weeks.","Neurophroline is a patented cosmetic ingredient derived from the wild indigo plant (Tephrosia purpurea). It is known for its soothing and anti-stress properties, particularly for the skin.","Neurophroline offers benefits such as:
- Reduces the appearance of stress-induced skin aging, such as fine lines and wrinkles caused by daily stressors.
- Helps soothe and calm irritated or sensitive skin, improving skin comfort and reducing redness.
- Assists in restoring the skin's natural balance and resilience, enhancing its ability to cope with environmental stressors.
- Promotes a more radiant and rejuvenated complexion by combating the visible signs of stress.","[' ', 'Acne', ' ', 'Dry and dehydrated skin', ' ', 'Redness', ' ', 'Radiance', ' ', 'Texture']","[' ', 'Related Allergy']",https://renude.co/ingredients/neurophroline
Retinyl Propionate,,"Retinyl Propionate is a part of the vitamin A family of ingredients and is an ester of retinol and propionic acid. It is designed to have better skin tolerability vs. retinol. Once absorbed, it is broken down in the body to retinol, then into retinaldehyde, and then again into retinoic acid, the active form recognised by the body to trigger it’s skin benefits. Studies have shown levels of 0.3% or higher are required to see benefits comparable with retinol. 

It is part of a family of ingredients also found on ingredients lists as encapsulated retinaldehyde, hydroxypinacolone retinoate, retinaldehyde, retinyl palmitate, retinyl propionate and retinyl retinoate (8x more powerful than retinol)","An ester of retinol and propionic acid, designed to improve stability and skin tolerability compared to retinol. It is the most effective of the retinoid esters, except retinyl retinoate.","This ingredient is an antioxidant that stimulates collagen production, treating fine lines, wrinkles and a reduction of elasticity in the skin which can naturally come with aging.  It exfoliates the skin, unclogging  pores, and improving the overall appearance of the skin making it smooth and supple.","[' ', 'Elasticity', ' ', 'Enlarged Pores', ' ', 'Fine Lines', ' ', 'Pigmentation', ' ', 'Radiance', ' ', 'Texture', ' ', 'Wrinkles']","[' ', 'Pregnancy', ' ', 'Sensitive', ' ', 'Impaired skin barrier']",https://renude.co/ingredients/retinyl-propionate
Retinyl Palmitate,,"Retinyl Palmitate is a part of the vitamin A family of ingredients. It is broken down in the body to retinol, and then into retinaldehyde, then again into retinoic acid, the active form recognised by the body to trigger its skin benefits.

It is part of a family of ingredients also found on ingredients lists as encapsulated retinaldehyde, hydroxypinacolone retinoate, retinaldehyde, retinol, retinyl propionate and retinyl retinoate (8x more powerful than retinol)","An ester of retinol and palmitic acid, made to be more gentle and less irritating than retinol. It is, however, significantly less effective than retinol, and doesn't have as many therapeutic effects as other retinoid esters (like retinyl propionate)!","This ingredient is an antioxidant that stimulates collagen production, treating fine lines.","[' ', 'Fine Lines']","[' ', 'Pregnancy', ' ', 'Impaired skin barrier']",https://renude.co/ingredients/retinyl-palmitate
Retinol,,"Retinol, is a part of the vitamin A family of ingredients and is one of the most well-researched actives used in skincare today. Retinol and all of its derivatives are broken down within the skin first into retinaldehyde, then into retinoic acid, the active form recognised by the body to trigger its skin benefits.

Retinoic acid (aka tretinoin) is the gold standard of anti-ageing and works in a number of ways. Firstly, it blocks the production of collagen-degrading enzymes, meaning collagen does not get broken down as quickly in the skin. After prolonged use (6M+), it has also been shown to stimulate the production of type I and type III collagen, reducing wrinkles and improving skin firmness. It has been shown to protect against UV-induced damage, as well as reducing the appearance of hyperpigmentation in the skin. Skin treated with retinoids is smoother, more even-toned, firmer and younger looking.

It is part of a family of ingredients also found on ingredients lists as encapsulated retinaldehyde, hydroxypinacolone retinoate, retinaldehyde, retinyl palmitate, retinyl propionate and retinyl retinoate (8x more powerful than retinol)","One of the most well researched and versatile cosmetic ingredients available, retinol is a powerhouse ingredient that is effective at smoothing, firming, brightening and evening out the skin.","This ingredient is an antioxidant that stimulates collagen production, treating fine lines, wrinkles and a reduction of elasticity in the skin which can naturally come with aging.  It exfoliates the skin, unclogging  pores, helping treat acne and blemishes and improving the overall appearance of the skin making it smooth and supple.","[' ', 'Acne', ' ', 'Blackheads', ' ', 'Elasticity', ' ', 'Enlarged Pores', ' ', 'Fine Lines', ' ', 'Pigmentation', ' ', 'Radiance', ' ', 'Texture', ' ', 'Wrinkles']","[' ', 'Pregnancy', ' ', 'Sensitive', ' ', 'Impaired skin barrier']",https://renude.co/ingredients/retinol
Resveratrol,,"Resveratrol is a family of ingredients also known as vitis vinifera (organic, cold pressed concord grape) seed oil, vitis vinifera (grape) flower cell extract, vitis vinifera (grape) fruit extract, vitis vinifera (grape) seed extract, vitis vinifera seed extract or vitis vinifera (organic). 

Most famously found in the skin of red grapes, but also occurring naturally in peanuts and certain fruits such as blueberries and cranberries. It is included in skincare for its powerful antioxidant abilities. Research shows it can protect against free radicals, as well as oxidative damage caused by UV.","Resveratrol is a natural polyphenolic compound found in various plants, particularly in the skin of grapes, red wine, and certain berries. In skincare, resveratrol is known for its potent antioxidant and anti-aging properties.","Resveratrol offers benefits such as:
- Provides antioxidant protection, helping to neutralize free radicals and prevent premature aging of the skin.
- Assists in reducing the appearance of fine lines and wrinkles, contributing to a smoother and more youthful complexion.
- Can help improve skin firmness and elasticity, promoting a more resilient and lifted appearance.
- May soothe and calm irritated skin, contributing to a more comfortable and balanced complexion.","[' ', 'Elasticity', ' ', 'Fine Lines', ' ', 'Pregnancy', ' ', 'Wrinkles']","[' ', 'Related Allergy']",https://renude.co/ingredients/resveratrol
Red Algae,,"Algae is an incredibly interesting natural ingredient source. It is essentially an underwater plant, designed to get its food from sunlight, much like any other plants, although from much more challenging conditions. There are many types of algae (kelp, laminaria, microalgae), but in general in all its forms it acts as a powerful antioxidant, protecting from free radical damage, as well as being able to hydrate the skin and deliver naturally-occurring vitamins into the skin.","Red algae are marine plant organisms that are rich in nutrients and minerals. In skincare, red algae extracts are used for their potential hydrating, antioxidant, and soothing properties.","Red algae offers benefits such as:
- Provides excellent hydration to the skin, helping to improve moisture retention and skin barrier function.
- Contains antioxidants that protect the skin from free radical damage, contributing to overall skin health.
- Assists in soothing and calming irritated or sensitive skin, reducing redness and promoting a more comfortable complexion.
- Can enhance the appearance of skin firmness and elasticity, contributing to a more youthful look.","[' ', 'Dry and dehydrated skin', ' ', 'Impaired skin barrier', ' ', 'Pregnancy', ' ', 'Texture']","[' ', 'Related Allergy']",https://renude.co/ingredients/red-algae
Quercetin,,"Quercetin is a naturally occurring bioflavonoid found in fruits and vegetables such as kale, onion, tomatoes and berries. It is used in skincare for its antioxidant abilities, meaning it can neutralise free radicals before they cause any damage to the skin. Studies also show Quercetin to have anti-inflammatory effects, and an ability to protect the skin against aggressors such as UV, histamine and toxic chemicals. It is also believed to support the skin barrier functioning, reducing water-loss via the skin to improve hydration levels in the epidermis.","Quercetin is a flavonoid, a type of plant-derived compound, that is used in skincare products for its antioxidant and anti-inflammatory properties.","Quercetin offers benefits such as:
- Provides antioxidant protection, helping to prevent premature aging and maintain skin health.
- Reduces inflammation and calms irritated skin, making it beneficial for individuals with sensitive or reactive skin.
- Supports collagen production, contributing to improved skin elasticity and firmness.
- Helps brighten the skin and improve the appearance of uneven skin tone.","[' ', 'Dry and dehydrated skin', ' ', 'Impaired skin barrier', ' ', 'Pregnancy', ' ', 'Texture']","[' ', 'Related Allergy']",https://renude.co/ingredients/quercetin
Pseudoalteromonas Exopolysaccharides,,"Pseudoalteromonas Exopolysaccharides are biotechnological marine alternatives to famous IT-moisturiser and humectant hyaluronic acid (HA). It is obtained by the fermentation of a marine bacterial strain.

It is in the class of Algae Extract which also include ahnfeltia concinna extract, alaria esculenta extract, algae exopolysaccharides, algin, alteromonas ferment extract, ascophyllum nodosum extract, asparagopsis armata extract, chlorella protothecoides, chlorella vulgaris extract, dunaliella salina (green algae) extract, hydrolyzed f-fucoidan, laminaria ochroleuca (kelp) extract, macrocystis pyrifera (kelp) extract, marine extract, parachlorella beijerinckii exopolysaccharides, plankton extract, porphyridium cruentum extract, padina pavonica thallus extract, tripleurospermum maritimum extract, vibrio alginolyticus ferment filtrate, chlorella protothecoides oil","It is rich in the same monosaccharide, called glucuronic acid, as Hyaluronic Acid, and has a similar effect on the skin.",Helps to moisturise the skin with some benefits including the treatment of wrinkles and fine lines.,"[' ', 'Dry and dehydrated skin', ' ', 'Fine Lines', ' ', 'Pregnancy', ' ', 'Wrinkles']","[' ', 'Related Allergy']",https://renude.co/ingredients/pseudoalteromonas-exopolysaccharides
Proline,,"A non-essential amino acid (meaning that our body can produce it) that's also one of the major building blocks of collagen. It is thought to be able to improve wrinkles when combined with other amino acids, glycine and leucine.

Amino acids are a class of ingredients. They can also be found on ingredients lists as acetyl glucosamine,acetyl tyrosinamide, alanine, arginine hcl, arginine pca, histidine, isoleucine, leucine, lysine, phenylalanine, serine, taurine, threonine and valine and yeast amino acids.",Proline is an amino-acid that our body can naturally produce and also one of the major building blocks of collagen.,"Helps to maintain firm, youthful skin through promoting collagen production and moisturising the skin.","[' ', 'Dry and dehydrated skin', ' ', 'Elasticity', ' ', 'Fine Lines', ' ', 'Pregnancy', ' ', 'Texture', ' ', 'Wrinkles']","[' ', 'Related Allergy']",https://renude.co/ingredients/proline
Potassium Azeloyl Diglycinate,,"Potassium Azeloyl Diglycinate (PAD) is a water-soluble derivative of azelaic acid which conveys many of the same benefits as pure azelaic acid. It is a gentle anti-inflammatory so is suitable for sensitive skin, and is able to improve rosacea and acne symptoms, as well as fading pigmentation left from acne.","Potassium Azeloyl Diglycinate is a multifunctional skincare ingredient derived from azelaic acid and glycine. It is used in cosmetics for its potential brightening, sebum-regulating, and skin-soothing properties.","PAD offers benefits such as:
- Helps regulate sebum production, making it beneficial for oily and acne-prone skin.
- Brightens the skin and promotes a more even complexion by inhibiting the production of melanin.
- Assists in reducing the appearance of dark spots and hyperpigmentation, improving skin tone.
- Has skin-soothing properties, helping to calm and alleviate skin redness and irritation.","[' ', 'Acne', ' ', 'Blackheads', ' ', 'Enlarged Pores', ' ', 'Pigmentation', ' ', 'Post Blemish Marks', ' ', 'Redness', ' ', 'Radiance', ' ', 'Pregnancy']","[' ', 'Related Allergy', ' ', 'Gluten Allery']",https://renude.co/ingredients/potassium-azeloyl-diglycinate
Probiotics,,"Probiotics can be defined as living bacteria which are good for the skin, and are useful to include in skincare formulations in order to populate a healthy microbiome (the ecosystem of bacteria on the skin). A diverse breadth in the strains of bacteria living on the skin results in a healthy microbiome, and some early research has linked certain imbalances in this microbiome to skin conditions such as acne, eczema and psoriasis.

Probiotics are a class of ingredients which can be found on ingredients lists as bifida ferment lysate, lactobacillus ferment, and lactococcus ferment lysate.","Probiotics are live beneficial microorganisms that provide various health benefits when applied to the skin. In skincare products, probiotics are used to support the skin's microbiome and promote overall skin health.","Probiotics offer benefits such as:
- Help maintain a balanced and healthy skin microbiome by supporting the growth of beneficial bacteria.
- Strengthen the skin's natural defense against harmful bacteria, reducing the risk of skin issues like acne and inflammation.
- Enhance the skin's barrier function, improving its resilience and protection against environmental stressors.
- Have soothing properties, helping to calm and alleviate skin irritation and redness.","[' ', 'Acne', ' ', 'Blackheads', ' ', 'Redness', ' ', 'Pregnancy']","[' ', 'Related Allergy']",https://renude.co/ingredients/probiotics
Prickly Pear Extract,,"Prickly pear is a cactus native to Mexico, and is used in skincare for its soothing and hydrating properties. It is also known as hydrolyzed opuntia ficus indica flower extract and opuntia ficus-indica fruit extract.","Prickly Pear Extract is derived from the fruit of the prickly pear cactus (Opuntia ficus-indica). In skincare, it is used for its potential hydrating, antioxidant, and skin-soothing properties.","Prickly pear extract offers benefits such as:
- Provides deep hydration to the skin, helping to retain moisture and improve skin barrier function.
- Contains antioxidants that neutralize free radicals, protecting the skin from environmental damage and premature aging.
- Assists in soothing and calming irritated or sensitive skin, reducing redness and promoting skin comfort.","[' ', 'Redness', ' ', 'Pregnancy']","[' ', 'Related Allergy']",https://renude.co/ingredients/prickly-pear-extract
