name,scientific_name,short_description,what_is_it,what_does_it_do,who_is_it_good_for,who_should_avoid,url
Ectoin,,"Ectoin is an emollient used in skincare to help maintain moisture balance in the skin. New research shows it may also be able to protect against certain environmental aggressors, such as pollutants and UV. This is believed to be down to its antioxidant properties, as well as the ability to protect skin from dehydration from the surrounding environment.","Ectoin is a natural, water-binding molecule known as a compatible solute, derived from certain extremophilic microorganisms. It is used in skincare for its potential hydrating, anti-inflammatory, and protective properties.","Ectoin offers benefits such as:
- Provides exceptional hydration, helping to lock in moisture and prevent water loss from the skin.
- Exhibits potent anti-inflammatory effects, assisting in soothing and calming irritated or sensitive skin.
- Offers protective properties against environmental stressors, such as UV radiation and pollution.
- Can enhance the skin's resilience and barrier function, promoting a healthier and more balanced complexion.","[' ', 'Dry and dehydrated skin', ' ', 'Impaired skin barrier', ' ', 'Pregnancy']","[' ', 'Related Allergy']",https://renude.co/ingredients/ectoin
Dunaliella Salina (Green Algae) Extract,,"A natural source of Vitamin B12,  it’s also a rich source of beta-carotene, and conveys potent antioxidant benefits that can benefit skin.

It is in the class of Algae Extract which also include ahnfeltia concinna extract, alaria esculenta extract, algae exopolysaccharides, algin, alteromonas ferment extract, alteromonas ferment extract, ascophyllum nodosum extract, asparagopsis armata extract, chlorella protothecoides, chlorella vulgaris extract, hydrolyzed f-fucoidan, laminaria ochroleuca (kelp) extract, macrocystis pyrifera (kelp) extract, and marine extract.","A type of micro-algae that’s known for being adaptable and able to survive even in harsh natural conditions. It is a rich source of beta-carotene, and conveys potent antioxidant benefits that can benefit skin.","It is a great anti-inflammatory, and anti aging active ingredient.","[' ', 'Dry and dehydrated skin', ' ', 'Fine Lines', ' ', 'Pregnancy', ' ', 'Wrinkles']","[' ', 'Related Allergy']",https://renude.co/ingredients/dunaliella-salina-green-algae-extract
Dioic Acid,,"Dioic acid is a naturally-occurring acid found in plant and animal fats/oils. It is used in skincare for its ability to regulate sebum production in the skin, as well as its antibacterial action against acne-causing C. Acnes bacteria. It has also been shown to visibly reduce hyperpigmentation, with results being comparable to that of hydroquinone (the gold standard prescription for treating hyperpigmentation).","Dioic acid, also known as sebacic acid, is a naturally occurring dicarboxylic acid derived from certain vegetable oils or animal fats. It is used in skincare for its potential benefits in controlling excess oil production and addressing acne-prone skin.","Dioic acid offers benefits such as:
- Helps regulate sebum production, making it beneficial for individuals with oily or acne-prone skin.
- Assists in reducing the appearance of enlarged pores, contributing to a smoother skin texture.
- Offers potential anti-inflammatory effects, helping to calm redness and irritation associated with acne.
- May improve overall skin clarity and tone, promoting a more even complexion.","[' ', 'Acne', ' ', 'Pigmentation', ' ', 'Pregnancy', ' ', 'Wrinkles']","[' ', 'Related Allergy']",https://renude.co/ingredients/dioic-acid
Cucumber Extract,,"Cucumber extract, also known as cucumis sativus (cucumber) fruit extract, cucumis sativus or cucumber fruit extract, provides natural antioxidant protection against free radicals. It is comprised of 95% water, plus small concentrations of ascorbic acid (vitamin c), caffeic acid (an antioxidant), fatty acids and silica (mineral required for healthy skin, hair & nails).","Cucumber extract is derived from the fruit of the cucumber plant, Cucumis sativus. It is used in skincare for its potential hydrating, soothing, and skin-conditioning properties.","Cucumber extract offers benefits such as:
- Provides excellent hydration, helping to moisturize and refresh the skin.
- Offers soothing and calming effects, making it beneficial for irritated or sensitive skin.
- Contains antioxidant properties, assisting in neutralizing free radicals and protecting the skin from environmental damage.
- Can improve the skin's overall texture, leaving it feeling soft and supple.","[' ', 'Pregnancy']","[' ', 'Related Allergy']",https://renude.co/ingredients/cucumber-extract
Dipeptide Diaminobutyroyl Benzylamide Diacetate,,"Dipeptide diaminobutyroyl benzylamide diacetate is an anti-ageing peptide, seen as an ingredient that makes skincare 'botox in a bottle'.

It is in a class of ingredients also found on ingredients lists as acetyl hexapeptide, acetyl tetrapeptide, acetylarginyltryptophyl diphenylglycine, arginine/lysine polypeptide, azelaoyl bis-dipeptide, copper heptapeptide-14 pantothenate, dipeptide diaminobutyroyl benzylamide diacetate, ferric hexapeptide, heptapeptide-15, palmitate, myristol hexapeptide, myristol pentapeptide, myristoyl nonapeptide, myristoyl pentapeptide, oligopeptide, palmitoyl  tripeptide, palmitoyl decapeptide, palmitoyl heptapeptide, palmitoyl hexapeptide, palmitoyl nonapeptide, palmitoyl oligopeptide, palmitoyl pentapeptide, palmitoyl tetrapeptide, palmitoyl tripeptide, palmitoyl tetrapeptide, pentapeptide, sh-oligopeptide, tetrapeptide and copper palmitoyl heptapeptide.","Many peptides function as anti-ageing ingredients in skincare, due to their ability to fit specific receptors in the body to trigger anti-ageing responses. This includes mechanisms like collagen production, cell regeneration or even blocking muscle contractions to smooth expression lines.","Used in skincare to treat fine lines, wrinkles and improve the skin's elasticity.","[' ', 'Elasticity', ' ', 'Fine Lines', ' ', 'Pregnancy', ' ', 'Wrinkles']","[' ', 'Related Allergy']",https://renude.co/ingredients/dipeptide-diaminobutyroyl-benzylamide-diacetate
Dipeptide,,"Dipeptide is an anti-ageing peptide, which facilitates the skin’s healing process and makes the skin firmer.

It is in a class of ingredients also found on ingredients lists as acetyl hexapeptide, acetyl tetrapeptide, acetylarginyltryptophyl diphenylglycine, arginine/lysine polypeptide, azelaoyl bis-dipeptide, copper heptapeptide-14 pantothenate, dipeptide diaminobutyroyl benzylamide diacetate, ferric hexapeptide, heptapeptide-15, palmitate, myristol hexapeptide, myristol pentapeptide, myristoyl nonapeptide, myristoyl pentapeptide, oligopeptide, palmitoyl  tripeptide, palmitoyl decapeptide, palmitoyl heptapeptide, palmitoyl hexapeptide, palmitoyl nonapeptide, palmitoyl oligopeptide, palmitoyl pentapeptide, palmitoyl tetrapeptide, palmitoyl tripeptide, palmitoyl tetrapeptide, pentapeptide, sh-oligopeptide, tetrapeptide and copper palmitoyl heptapeptide.  ","Many peptides function as anti-ageing ingredients in skincare, due to their ability to fit specific receptors in the body to trigger anti-ageing responses. This includes mechanisms like collagen production, cell regeneration or even blocking muscle contractions to smooth expression lines.","Used in skincare to treat fine lines, wrinkles and improve the skin's elasticity.","[' ', 'Elasticity', ' ', 'Fine Lines', ' ', 'Pregnancy', ' ', 'Wrinkles']","[' ', 'Related Allergy']",https://renude.co/ingredients/dipeptide
Copper Peptide,,"Copper peptides are a family of ingredients also known as copper tripeptide growth factor, tripeptide and copper peptide. They are used in skincare as an anti-ageing ingredient. As with most peptides, it works by activating a receptor in the skin to perform a certain function, e.g. produce more collagen. Studies have shown copper peptide to have a positive impact on skin density, firmness and depth of fine lines and wrinkles.","Copper peptide is a combination of copper and peptides, which are short chains of amino acids. It is used in skincare for its potential anti-aging, skin-repairing, and wound-healing properties.","Copper peptide offers benefits such as:
- Supports skin rejuvenation and anti-aging efforts by promoting collagen production and increasing skin elasticity.
- Provides antioxidant benefits, helping to protect the skin from free radicals and oxidative damage.
- Assists in wound healing and tissue repair, making it beneficial for post-inflammatory hyperpigmentation and scar reduction.
- Can enhance the skin's overall texture and tone, promoting a smoother and more youthful appearance.","[' ', 'Elasticity', ' ', 'Fine Lines', ' ', 'Pregnancy', ' ', 'Wrinkles']","[' ', 'Related Allergy']",https://renude.co/ingredients/copper-peptide
Copper Palmitoyl Heptapeptide,,"Many peptides function as anti-ageing ingredients in skincare, due to their ability to fit specific receptors in the body to trigger anti-ageing responses. This includes mechanisms like collagen production, cell regeneration or even blocking muscle contractions to smooth expression lines. Peptides are made up of amino acids, and are unique in shape, with a huge variety available to target specific responses in the body.","Copper palmitoyl heptapeptide-14 is a type of copper peptide which is made from copper, palmitic acid and peptides. It used in skincare for its ability to minimise visible signs of ageing in the skin. According to the manufacturer, it has been proven to effectively increase the production of collagen and elastin in the skin, to improve the appearance of wrinkles.","Used in skincare to treat fine lines, wrinkles and improve the skin's elasticity.","[' ', 'Elasticity', ' ', 'Fine Lines', ' ', 'Pregnancy', ' ', 'Wrinkles']","[' ', 'Related Allergy']",https://renude.co/ingredients/copper-palmitoyl-heptapeptide
Copper Heptapeptide-14 Pantothenate,,"It encapsulates copper peptides and reduces wrinkles. It helps gene expression of collagen & elastin and increases elasticity.

It is in a class of ingredients also found on ingredients lists as acetyl hexapeptide, acetyl tetrapeptide, acetylarginyltryptophyl diphenylglycine, arginine/lysine polypeptide, azelaoyl bis-dipeptide, dipeptide, dipeptide diaminobutyroyl benzylamide diacetate, ferric hexapeptide, heptapeptide-15, palmitate, myristol hexapeptide, myristol pentapeptide, myristoyl nonapeptide, myristoyl pentapeptide, oligopeptide, palmitoyl  tripeptide, palmitoyl decapeptide, palmitoyl heptapeptide, palmitoyl hexapeptide, palmitoyl nonapeptide, palmitoyl oligopeptide, palmitoyl pentapeptide, palmitoyl tetrapeptide, palmitoyl tripeptide, palmitoyl tetrapeptide, pentapeptide, sh-oligopeptide, tetrapeptide and copper palmitoyl heptapeptide. ","Many peptides function as anti-ageing ingredients in skincare, due to their ability to fit specific receptors in the body to trigger anti-ageing responses. This includes mechanisms like collagen production, cell regeneration or even blocking muscle contractions to smooth expression lines.","Used in skincare to treat fine lines, wrinkles and improve the skin's elasticity.","[' ', 'Elasticity', ' ', 'Fine Lines', ' ', 'Pregnancy', ' ', 'Wrinkles']","[' ', 'Related Allergy']",https://renude.co/ingredients/copper-heptapeptide-14-pantothenate
Coffee Seed Extract,,"Also known as coffea arabica (coffee) seed extract, this natural extract, derived from coffee beans, is high in antioxidants so first and foremost, offers protection against free radical damage. Studies have also shown this to have restorative properties, resulting in a healthier, smoother skin feel, as well as potentially improving the skin’s ability to retain moisture.","Coffee seed extract is derived from the seeds (beans) of the coffee plant. It is used in skincare for its potential antioxidant, anti-inflammatory, and skin-energizing properties.","Coffee seed extract offers benefits such as:
- Provides antioxidant protection, helping to neutralize free radicals and reduce oxidative stress on the skin.
- Exhibits potential anti-inflammatory effects, assisting in soothing and calming the skin.
- Contains caffeine, which may help improve circulation and temporarily reduce the appearance of puffiness.
- Offers potential skin-energizing benefits, contributing to a refreshed and awakened complexion.","[' ', 'Redness', ' ', 'Pregnancy']","[' ', 'Related Allergy']",https://renude.co/ingredients/coffee-seed-extract
Citric Acid,,"Citric acid (in dilution) is often used in tiny quantities to adjust the pH of a formula to be more acidic. In higher doses, it acts as an Alpha Hydroxy Acid (AHA), encouraging the skin’s natural exfoliation process to brighten, smooth and refine overall skin texture.","Citric acid is a naturally occurring organic acid found in various fruits, particularly citrus fruits like lemons, oranges, and limes. It is used in skincare for its potential exfoliating, pH-adjusting, and antioxidant properties.","Citric acid offers benefits such as:
- At higher concentrations, it provides exfoliating benefits, helping to remove dead skin cells and promote a smoother, more radiant complexion.
- Assists in adjusting the pH level of skincare products, ensuring their effectiveness and compatibility with the skin's natural pH.","[' ', 'Acne', ' ', 'Blackheads', ' ', 'Radiance', ' ', 'Pregnancy', ' ', 'Texture']","[' ', 'Related Allergy']",https://renude.co/ingredients/citric-acid
Cinnamon Bark,,"Cinnamon bark, also known as cinnamomum zeylanicum bark extract, acts as a natural antibacterial to help prevent the growth of acne-causing bacteria. It is also thought to regulate sebum production to prevent pores from becoming blocked. As it is a plant extract, it is naturally high in antioxidants which offer the skin protection against free radical damage.","Cinnamon bark extract is derived from the bark of the cinnamon tree, Cinnamomum verum or Cinnamomum cassia. It is used in skincare for its potential antioxidant, antimicrobial, and soothing properties.","Cinnamon bark extract offers benefits such as:
- Provides antioxidant benefits, helping to neutralize free radicals and protect the skin from oxidative damage.
- Exhibits potential antimicrobial properties
- May offer soothing effects, helping to reduce redness and irritation.","[' ', 'Acne', ' ', 'Pregnancy']","[' ', 'Related Allergy']",https://renude.co/ingredients/cinnamon-bark
Fomes Ofﬁcinalis (Mushroom) Extract,,Fomes ofﬁcinalis is in a class of ingredients also known as mushroom extract and polyporus umbellatus (mushroom) extract,"It is an active and it has astringent, pore tightening and moisturising effects on the skin.","It helps even your skin’s tone and firmness, and it drastically helps to clear pores and minimise the visible appearance of skin suffering from excess sebum secretion.","[' ', 'Enlarged Pores', ' ', 'Oily', ' ', 'Radiance']","[' ', 'Related Allergy']",https://renude.co/ingredients/fomes-officinalis-mushroom-extract
Ginkgo Biloba,,"Ginkgo Biloba is a tree native to Asia, one of the oldest plant species on the planet, and rich in flavonoids and terpenoids. These provide powerful antioxidant protection, reducing potential damage caused by reactive free radicals. Studies have also shown Ginkgo Biloba to provide skin-smoothing and hydrating properties.","Ginkgo biloba extract is derived from the leaves of the Ginkgo biloba tree, one of the oldest tree species on Earth. It is used in skincare for its potential antioxidant, anti-inflammatory, and skin-protective properties.","Ginkgo biloba offers benefits such as:
- Provides antioxidant benefits, helping to neutralize free radicals and reduce oxidative stress on the skin.
- Exhibits potential anti-inflammatory effects, assisting in calming redness and irritation.
- Supports the skin's natural defense against environmental stressors, such as UV radiation and pollution.
- May help improve overall skin tone and texture, promoting a more radiant complexion.","[' ', 'Redness', ' ', 'Pregnancy']","[' ', 'Related Allergy']",https://renude.co/ingredients/ginkgo-biloba
Fructooligosaccharides,,"Fructooligosaccharides are in a class of prebiotic ingredients also found on ingredients lists as alpha-glucan oligosaccharide, fructooligosaccharides, lactobacillus extract filtrate, rhamnose and saccharomyces cerevisiae (yeast) extract.

Prebiotics are a class of ingredients which can be found on ingredients lists as alpha-glucan oligosaccharide, lactobacillus extract filtrate, rhamnose and saccharomyces cerevisiae (yeast) extract. ","Prebiotics are a type of non-digestible dietary fiber used in skincare products to support the skin's microbiome, which consists of beneficial bacteria that contribute to skin health.","Prebiotics offer benefits such as:
- Help maintain a balanced and healthy skin microbiome by promoting the growth of beneficial bacteria.
- Support the skin's natural defenses against harmful microorganisms, contributing to overall skin health.
- Enhance the skin's barrier function, reducing moisture loss and improving hydration.
- Can have a calming effect on the skin, helping to soothe and alleviate inflammation and irritation.","[' ', 'Acne', ' ', 'Blackheads', ' ', 'Redness', ' ', 'Pregnancy']","[' ', 'Related Allergy']",https://renude.co/ingredients/fructooligosaccharides
Feverfew Extract,,"Feverfew has been used in ancient medicine for centuries to treat everything from headaches, constipation, vertigo, worms, spasms & arthritis. One of the oil-soluble flavonoids, Tanetin, has been shown to modulate inflammatory responses in the body, whilst other flavonoids provide antioxidant protection.","Feverfew extract is derived from the leaves and flowers of the feverfew plant (Tanacetum parthenium). It is used in skincare for its potential anti-inflammatory, soothing, and skin-calming properties.","Feverfew extract offers benefits such as:
- Exhibits potential anti-inflammatory effects, helping to calm redness and irritation on the skin.
- Assists in soothing sensitive or reactive skin, making it beneficial for those with skin conditions like rosacea or eczema.
- Provides antioxidant benefits, helping to neutralize free radicals and protect the skin from environmental damage.
- Can enhance the overall appearance of the skin, promoting a more even and balanced complexion.","[' ', 'Redness', ' ', 'Pregnancy']","[' ', 'Related Allergy']",https://renude.co/ingredients/feverfew-extract
Ferulic Acid,,"Ferulic acid is a naturally occurring acid found in plants, such as bran. It is used in skincare for its antioxidant properties, meaning it can neutralise free radicals before they can cause any cellular damage. It has also been shown to stabilise Vitamins C and E when used in combination, resulting in a boost in their efficacy vs being used without the addition of Ferulic acid.","Ferulic acid is a plant-based antioxidant that occurs naturally in various fruits, vegetables, grains, and seeds. It is used in skincare for its potential antioxidant, anti-aging, and skin-protective properties.","Ferulic acid offers benefits such as:
- Provides powerful antioxidant benefits, helping to neutralize free radicals and reduce oxidative stress on the skin.
- Enhances the stability and effectiveness of other antioxidants, maximizing their protective capabilities.
- May help protect the skin from UV-induced damage, although it is not a substitute for sunscreen.
- Assists in promoting a more even skin tone and reducing the appearance of hyperpigmentation.","[' ', 'Pregnancy']","[' ', 'Related Allergy']",https://renude.co/ingredients/ferulic-acid
Ethylhexyl Triazone,,"Ethylhexyl Triazone is a synthetic UV filter offering protection against the full UVB wavelength spectrum 280-320 nm. 

Other ingredients in the class of synthetic UV filters include bis-ethylhexyloxyphenol methoxyphenyl triazine, butyl methoxydibenzoylmethane, ethylhexyl salicylate,, homosalate, octinoxate, octisalate, octocrylene and triazine diethyl butamidotriazone.","Ethylhexyl Triazone is a synthetic sunscreen ingredient used in sun care products to protect against UVB rays. It is an extremely photo stable ingredient which doesn't degrade on exposure to UV light, as many other UV filters do.","Ethylhexyl Triazone offers SPF protection via absorbing UVB light in the outer layers of the epidermis, then converting it into heat (to neutralise the energy which can lead to cell damage), and scattering it away from the body. It is an oil soluble, odourless and colourless powder that works well in fragrance-free formulations.","[' ', 'UV Protection']","[' ', 'Pregnancy', ' ', 'Sensitive']",https://renude.co/ingredients/ethylhexyl-triazone
Ferric Hexapeptide,,"Ferric hexapeptide is an anti-ageing peptide and is used in skincare to treat fine lines and wrinkles. 

It is in a class of ingredients also found on ingredients lists as acetylarginyltryptophyl diphenylglycine, acetyl tetrapeptide, arginine/lysine polypeptide, azelaoyl bis-dipeptide, copper heptapeptide-14 pantothenate, dipeptide, dipeptide diaminobutyroyl benzylamide diacetate, heptapeptide-15, palmitate, myristol hexapeptide, myristol pentapeptide, myristoyl nonapeptide, myristoyl pentapeptide, oligopeptide, palmitoyl  tripeptide, palmitoyl decapeptide, palmitoyl heptapeptide, palmitoyl hexapeptide, palmitoyl nonapeptide, palmitoyl oligopeptide, palmitoyl pentapeptide, palmitoyl tetrapeptide, palmitoyl tripeptide, palmitoyl tetrapeptide, pentapeptide, sh-oligopeptide, tetrapeptide and copper palmitoyl heptapeptide. ","Many peptides function as anti-ageing ingredients in skincare, due to their ability to fit specific receptors in the body to trigger anti-ageing responses. This includes mechanisms like collagen production, cell regeneration or even blocking muscle contractions to smooth expression lines.","Used in skincare to treat fine lines, wrinkles and improve the skin's elasticity.","[' ', 'Elasticity', ' ', 'Fine Lines', ' ', 'Pregnancy', ' ', 'Wrinkles']","[' ', 'Related Allergy']",https://renude.co/ingredients/ferric-hexapeptide
Fernblock,,"Known as FernBlock, this is a patented active from Heliocare, developed alongside Harvard medical school. It is derived from a tropical fern native to South America, and works by protecting against UVB-induced sunburn, as well as protecting against UVA and Infrared wavelengths. The active is also able to support cell renewal and protect from cumulative damage caused by sun exposure (such as ageing and DNA damage). It is an antioxidant, protecting against free radicals, and has been shown to boost production of collagen, elastin and hyaluronic acid in the skin.","FernBlock, a patented active developed in collaboration with Harvard Medical School by Heliocare, is derived from a tropical fern native to South America. It provides comprehensive sun protection against UVB-induced sunburn, UVA, and Infrared wavelengths, supporting cell renewal, defending against cumulative sun damage, and promoting collagen, elastin, and hyaluronic acid production for healthier, more youthful skin.","FernBlock offers benefits such as:
- Provides antioxidant benefits, helping to neutralize free radicals and reduce oxidative stress on the skin.
- Thought to support hyaluronic acid production in the skin, assisting in promoting plump skin and smoothing fine lines.","[' ', 'Pregnancy']","[' ', 'Related Allergy']",https://renude.co/ingredients/fernblock
Evening Primrose Oil,,"Evening primrose oil is derived from the seeds of the Oenothera biennis plant. It is naturally rich in omega-6, which provides anti-inflammatory benefits, as well as supports the skin's natural lipid barrier. Evening primrose oil also acts as an antioxidant to offer protection against free radical damage.","Evening primrose oil is a plant-based oil extracted from the seeds of the evening primrose plant (Oenothera biennis). It is used in skincare for its potential anti-inflammatory, moisturizing, and skin-nourishing properties.","Evening primrose oil offers benefits such as:
- Provides excellent moisturization, helping to nourish and hydrate the skin.
- Exhibits potential anti-inflammatory effects, assisting in calming redness and irritation.
- Supports the skin's natural barrier function, promoting a smoother and more supple complexion.
- Can be beneficial for skin conditions like eczema and dermatitis due to its hydrating and soothing properties.","[' ', 'Dry and dehydrated skin', ' ', 'Impaired skin barrier', ' ', 'Pregnancy']","[' ', 'Related Allergy']",https://renude.co/ingredients/evening-primrose-oil
