name,scientific_name,short_description,what_is_it,what_does_it_do,who_is_it_good_for,who_should_avoid,url
Lily Extract,,"Lily extract is derived from various species of lilies, particularly Lilium candidum (also known as Madonna lily) or Lilium longiflorum. In skincare, lily extract is used for its potential skin-soothing, moisturizing, and brightening properties.",Botanical extract used in skincare for its antioxidant and skin-smoothing properties.,"Lily extract offers benefits such as:
- Provides soothing benefits, helping to calm and reduce redness or irritation in the skin.
- Assists in maintaining skin hydration, contributing to a more supple and moisturized complexion.
- Provides antioxidant benefits to prevent and treat environmental damage.","[' ', 'Pregnancy']","[' ', 'Related Allergy']",https://renude.co/ingredients/lily-extract
Luffa Cylindrica Extract,,"Luffa Cylindrica Extract, also known as sponge gourd or loofah, is derived from the fruit of the Luffa cylindrica plant. In skincare, this extract is used for its potential exfoliating, cleansing, and skin-smoothing properties.",Luffa Cylindrica extract is a natural plant extract which provides antioxidant protection against free radicals.,"Luffa cylindrica extract offers benefits such as:
- Provides gentle exfoliation, helping to remove dead skin cells, dirt, and impurities from the skin's surface.
- Can help improve skin texture and promote a smoother, more refined appearance.","[' ', 'Pregnancy']","[' ', 'Related Allergy']",https://renude.co/ingredients/luffa-cylindrica-extract
Linolenic Acid,,"Alpha Linolenic Acid (ALA) is a plant-based Omega 3 fatty acid, found in plant oils such as flaxseed and soy. ALA provides anti-inflammatory effects by inhibiting the production of inflammatory mediators in the body. ALA also supports healthy skin barrier functioning, by inhibiting levels of trans-epidermal water loss (TEWL), and therefore maintaining adequate levels of hydration in the epidermis, resulting in smooth, soft & moisturised skin.

Linolenic acid is in the class of essential lipids, and can be found on ingredient lists as caprooyl phytosphingosine, caprooyl sphingosine, cholesterol, glycolipids, glycoproteins, glycosphingolipids, Lecithin, linoleic acid, phospholipids and phytosphingosine.","Essential lipids, also known as skin-identical lipids, are a group of natural fats (lipids) found in the outermost layer of the skin. They play a crucial role in maintaining the skin's barrier function and overall health.","Essential lipids offer benefits such as:
- Help strengthen the skin's natural barrier, improving It's ability to retain moisture and nutrients.
- Support skin cell cohesion, promoting a smooth and even skin texture.
- Protect the skin from external irritants, pollutants, and allergens.
- Contribute to the skin's resilience and overall health, helping to prevent dryness and sensitivity.","[' ', 'Dry and dehydrated skin', ' ', 'Impaired skin barrier', ' ', 'Radiance', ' ', 'Pregnancy', ' ', 'Texture']","[' ', 'Related Allergy']",https://renude.co/ingredients/linolenic-acid
Linoleic Acid,,"Linoleic Acid is an Omega 6 essential fatty acid (EFA), found in many plant oils: corn, safflower & sunflower. Linoleic acid forms the fatty acid based of Ceramides EOH, EOS and EOP, which are essential for the normal functioning of the skin barrier. Applying linoleic acid topically helps to support ceramide functioning within the skin, leading to improved skin hydration and smoothness.

Research also shows that sebum in acne-prone skin can be lacking in Omega 6 (with too much Omega 3), so there is evidence to suggest applying this topically can help to balance the sebum composition and in turn reduce acne lesions. 

Linoleic Acid is in the class of essential lipids, and can be found on ingredient lists as caprooyl phytosphingosine, caprooyl sphingosine, cholesterol, glycolipids, glycoproteins, glycosphingolipids, Lecithin, linolenic acid, phospholipids and phytosphingosine.","Essential lipids, also known as skin-identical lipids, are a group of natural fats (lipids) found in the outermost layer of the skin. They play a crucial role in maintaining the skin's barrier function and overall health.","Essential lipids offer benefits such as:
- Help strengthen the skin's natural barrier, improving It's ability to retain moisture and nutrients.
- Support skin cell cohesion, promoting a smooth and even skin texture.
- Protect the skin from external irritants, pollutants, and allergens.
- Contribute to the skin's resilience and overall health, helping to prevent dryness and sensitivity.","[' ', 'Dry and dehydrated skin', ' ', 'Impaired skin barrier', ' ', 'Radiance', ' ', 'Pregnancy', ' ', 'Texture']","[' ', 'Related Allergy']",https://renude.co/ingredients/linoleic-acid
Leucine,,"Leucine is an amino acid that has anti-aging properties. It is used in anti-aging skin care products and is thought to help regenerate aging skin and reduce fine lines and sagging skin. It is said to create firmer, more supple skin and increase elasticity by repairing aging skin tissue. 

Amino acids are a class of ingredients. They can also be found on ingredients lists as acetyl glucosamine,acetyl tyrosinamide, alanine, arginine hcl, arginine pca, histidine, isoleucine, lysine, phenylalanine, proline, serine, taurine, threonine and valine and yeast amino acids.","Leucine is present in the ""natural moisturising factors (NMFs)"" which moisturise and hydrate the skin.",This anti-aging amino acid is found to help regenerate and its antioxidant properties help protect the skin in the process.,"[' ', 'Dry and dehydrated skin', ' ', 'Elasticity', ' ', 'Fine Lines', ' ', 'Impaired skin barrier', ' ', 'Pregnancy', ' ', 'Texture', ' ', 'Wrinkles']","[' ', 'Related Allergy']",https://renude.co/ingredients/leucine
Licorice Extract,,"It has been shown to prevent and reverse UV-induced skin damage, to provide visible skin-lightening properties to the skin. Its second active component, glycyrrhetinic acid is used in skincare for its anti-inflammatory benefits. It works by inhibiting the production of inflammatory substances, such as cortisone, within the body, with some research showing results to be comparable to prescription hydrocortisone cream.

Licorice is a family of ingredients and can also be known as ammonium glycyrrhizate, dipotassium glycyrrhizate (licorice), glycyrrhetinic acid, glycyrrhiza glabra (licorice) root extract, glycyrrhiza glabra root extract or glycyrrhiza inflata root extract.","Licorice extract is derived from the root of the licorice plant (glycyrrhiza glabra) and is a popular skincare ingredient known for its potential anti-inflammatory, skin-brightening, and soothing properties. Licorice extract contains active compounds such as glycyrrhizin, glabridin, and liquiritin, which contribute to its skincare benefits.","Licorice root extract offers benefits such as:
- Provides anti-inflammatory benefits, helping to calm and reduce redness or irritation in the skin.
- Acts as a skin-brightening agent, helping to fade dark spots, hyperpigmentation, and even out the skin tone.
- Can help soothe and alleviate sensitive or reactive skin.
- Supports overall skin health, contributing to a more balanced and rejuvenated complexion.","[' ', 'Pigmentation', ' ', 'Post Blemish Marks', ' ', 'Redness', ' ', 'Radiance', ' ', 'Pregnancy']","[' ', 'Related Allergy']",https://renude.co/ingredients/licorice-extract
Natural Moisturising Factors,,"They are a substance produced by the body, made up of minerals, lactate, urea, amino acids & humectants, which coats the surface skin cells to keep them moisturised. NMF increases the skin’s ability to retain moisture, which results in more hydrated, plump, smoother skin.

Natural moisturising factor (NMF) are a class of ingredients that can also be known by sodium lactate, sodium pca and trehalose. ","Natural Moisturizing Factors (NMFs) are a group of naturally occurring substances found in the skin's outermost layer, the stratum corneum. They play a crucial role in maintaining the skin's hydration and barrier function.","NMFs offer benefits such as:
- Provide essential hydration to the skin, attracting and retaining moisture from the environment.
- Help maintain the skin's barrier function, preventing excessive water loss and protecting against external irritants.
- Contribute to the suppleness and smoothness of the skin's surface.
- Play a vital role in the overall health and appearance of the skin.","[' ', 'Dry and dehydrated skin', ' ', 'Impaired skin barrier', ' ', 'Redness', ' ', 'Radiance', ' ', 'Texture']","[' ', 'Related Allergy']",https://renude.co/ingredients/natural-moisturising-factors
Licochalcone A,,"Licochalcone A is a naturally occurring compound found in the root extract of the licorice plant (Glycyrrhiza glabra). It is used in skincare for its potential anti-inflammatory, antioxidant, and skin-soothing properties.","Derived from licorice, this ingredient has shown to protect skin against damage from high energy visible light (HEVIS), and is more effective at this than some of the most established antioxidant ingredients (including vitamin C!)","Licochalcone A offers benefits such as:
- Acts as an antioxidant, protecting the skin from oxidative stress caused by free radicals.
- Can help improve the appearance of uneven skin tone and reduce redness or discoloration.
- Supports overall skin health, contributing to a more balanced and radiant complexion.","[' ', 'Pregnancy']","[' ', 'Related Allergy']",https://renude.co/ingredients/licochalcone-a
Naringenin Chalcone,,"Naringenin chalcone is a flavonoid compound derived from citrus fruits, particularly grapefruits. In skincare, it is used for its potential antioxidant, anti-inflammatory, and skin-brightening properties.","A plant polyphenol that occurs naturally in the skin of citrus fruits, this works to calm reactive skin as well as reduce associated redness.","Naringenin Chalcone offers benefits such as:
- Provides antioxidant benefits, helping to neutralize free radicals and protect the skin from environmental damage.
- Acts as an anti-inflammatory agent, helping to soothe and calm irritated or inflamed skin.
- Can help improve the appearance of uneven skin tone and promote a brighter complexion.","[' ', 'Impaired skin barrier', ' ', 'Redness', ' ', 'Pregnancy']","[' ', 'Related Allergy']",https://renude.co/ingredients/naringenin-chalcone
Myristoyl Nonapeptide,,"Myristoyl Nonapeptide-3 is a anti-aging peptide that increases cell turnover and collagen synthesis without causing negative side effects.

It is in a class of ingredients also found on ingredients lists as acetylarginyltryptophyl diphenylglycine, acetyl tetrapeptide, arginine/lysine polypeptide, azelaoyl bis-dipeptide, copper heptapeptide-14 pantothenate, dipeptide, dipeptide diaminobutyroyl benzylamide diacetate, ferric hexapeptide, heptapeptide-15, palmitate, myristol hexapeptide, myristol pentapeptide, myristoyl pentapeptide, oligopeptide, palmitoyl  tripeptide, palmitoyl decapeptide, palmitoyl heptapeptide, palmitoyl hexapeptide, palmitoyl nonapeptide, palmitoyl oligopeptide, palmitoyl pentapeptide, palmitoyl tetrapeptide, palmitoyl tripeptide, palmitoyl tetrapeptide, pentapeptide, sh-oligopeptide, tetrapeptide and copper palmitoyl heptapeptide. 
 ","Many peptides function as anti-ageing ingredients in skincare, due to their ability to fit specific receptors in the body to trigger anti-ageing responses. This includes mechanisms like collagen production, cell regeneration or even blocking muscle contractions to smooth expression lines.","Used in skincare to treat fine lines, wrinkles and improve the skin's elasticity.","[' ', 'Elasticity', ' ', 'Fine Lines', ' ', 'Pregnancy', ' ', 'Wrinkles']","[' ', 'Related Allergy']",https://renude.co/ingredients/myristoyl-nonapeptide
Myristol Pentapeptide,,"Myristoyl pentapeptide is an anti-aging peptide that promotes cell regeneration and is used in skincare to treat fine lines and wrinkles. 

It is in a class of ingredients also found on ingredients lists as acetylarginyltryptophyl diphenylglycine, acetyl tetrapeptide, arginine/lysine polypeptide, azelaoyl bis-dipeptide, copper heptapeptide-14 pantothenate, dipeptide, dipeptide diaminobutyroyl benzylamide diacetate, ferric hexapeptide, heptapeptide-15, palmitate, myristol hexapeptide, myristoyl nonapeptide, myristoyl pentapeptide, oligopeptide, palmitoyl  tripeptide, palmitoyl decapeptide, palmitoyl heptapeptide, palmitoyl hexapeptide, palmitoyl nonapeptide, palmitoyl oligopeptide, palmitoyl pentapeptide, palmitoyl tetrapeptide, palmitoyl tripeptide, palmitoyl tetrapeptide, pentapeptide, sh-oligopeptide, tetrapeptide and copper palmitoyl heptapeptide. ","Many peptides function as anti-ageing ingredients in skincare, due to their ability to fit specific receptors in the body to trigger anti-ageing responses. This includes mechanisms like collagen production, cell regeneration or even blocking muscle contractions to smooth expression lines.","Used in skincare to treat fine lines, wrinkles and improve the skin's elasticity.","[' ', 'Elasticity', ' ', 'Fine Lines', ' ', 'Pregnancy', ' ', 'Wrinkles']","[' ', 'Related Allergy']",https://renude.co/ingredients/myristol-pentapeptide
Milk Thistle Extract,,"Milk thistle extract is derived from the seeds of the milk thistle plant (Silybum marianum). In skincare, it is used for its potential antioxidant, anti-inflammatory, and skin-protecting properties.","Milk thistle extract is used in skincare for its soothing and skin-restoring abilities, as well as its antioxidant abilities. It can also be known silybum marianum (milk thistle) fruit extract, silybum marianum extract or silybum marianum fruit extract.","Milk thistle extract offers benefits such as:
- Provides antioxidant benefits, helping to neutralize free radicals and protect the skin from environmental damage.
- Acts as an anti-inflammatory agent, helping to soothe and calm irritated or inflamed skin.","[' ', 'Impaired skin barrier', ' ', 'Redness', ' ', 'Pregnancy']","[' ', 'Related Allergy']",https://renude.co/ingredients/milk-thistle-extract
Myristol Hexapeptide,,"A synthetic, fatty acid-linked peptide known to improve the skin's resilience, visibly calm, and help the skin look and feel smoother and softer. Myristoyl hexapeptide-16 is categorized as a protein-stimulating peptide, which means it can help skin's surface look better and become more resistant to moisture loss.

It is in a class of ingredients also found on ingredients lists as acetyl hexapeptide, acetyl tetrapeptide, acetylarginyltryptophyl diphenylglycine, arginine/lysine polypeptide, azelaoyl bis-dipeptide, myristol hexapeptide, dipeptide, dipeptide diaminobutyroyl benzylamide diacetate, ferric hexapeptide,  palmitate, myristol hexapeptide, myristol pentapeptide, myristoyl nonapeptide, myristoyl pentapeptide, oligopeptide, palmitoyl  tripeptide, palmitoyl decapeptide, palmitoyl heptapeptide, palmitoyl hexapeptide, palmitoyl nonapeptide, palmitoyl oligopeptide, palmitoyl pentapeptide, palmitoyl tetrapeptide, palmitoyl tripeptide, palmitoyl tetrapeptide, pentapeptide, sh-oligopeptide, tetrapeptide and copper palmitoyl heptapeptide.","Many peptides function as anti-ageing ingredients in skincare, due to their ability to fit specific receptors in the body to trigger anti-ageing responses. This includes mechanisms like collagen production, cell regeneration or even blocking muscle contractions to smooth expression lines.","Used in skincare to treat fine lines, wrinkles and improve the skin's elasticity.","[' ', 'Elasticity', ' ', 'Fine Lines', ' ', 'Pregnancy', ' ', 'Wrinkles']","[' ', 'Related Allergy']",https://renude.co/ingredients/myristol-hexapeptide
Mushroom Extract,,"Mushroom extracts are derived from various types of mushrooms, such as shiitake, reishi, and chaga. In skincare, they are used for their potential anti-inflammatory, antioxidant, and skin-soothing properties. Studies have shown that compounds from specific mushroom types can inhibit tyrosinase activity (an enzyme involved in melanin synthesis), which in turn visibly minimises areas of hyperpigmentation.

Mushroom extract is a class of ingredients also known by fomes ofﬁcinalis (mushroom) extract, fomes officinalis (mushroom) extract and polyporus umbellatus (mushroom) extract.",Mushroom Extract is used in skincare to naturally brighten the skin and reduce hyperpigmentation.,"Mushroom extracts offer benefits such as:
- Provide anti-inflammatory benefits, helping to soothe and calm irritated or sensitive skin.
- Act as antioxidants, protecting the skin from oxidative stress and environmental damage caused by free radicals.
- Can help improve the appearance of uneven skin tone and reduce redness or discoloration.","[' ', 'Pigmentation', ' ', 'Pregnancy']","[' ', 'Related Allergy']",https://renude.co/ingredients/mushroom-extract
Moringa Seed Extract,,"Moringa seed extract is derived from the seeds of the Moringa oleifera tree, also known as the ""Miracle Tree"" or ""Tree of Life."" In skincare, it is used for its potential nourishing, antioxidant, and skin-protecting properties.","Moringa seeds contain a wealth of over 30 antioxidants, helping to provide protection against free radical damage. It also contains Vitamins A, C, and E, and is thought to have skin soothing abilities.","Moringa seed extract offers benefits such as:
- Provides nourishment and hydration to the skin, helping to maintain its moisture balance.
- Acts as an antioxidant, protecting the skin from free radicals and environmental stressors.
- Can help improve the appearance of fine lines and wrinkles, contributing to a more youthful complexion.","[' ', 'Dry and dehydrated skin', ' ', 'Impaired skin barrier', ' ', 'Redness', ' ', 'Radiance', ' ', 'Pregnancy', ' ', 'Texture']","[' ', 'Related Allergy']",https://renude.co/ingredients/moringa-seed-extract
Marshmallow Root,,"Marshmallow root is extracted from the Althea plant, native to Northern Africa, Europe and Western Asia, and is rich in polysaccharides and flavonoids. The polysaccharides provide natural humectant benefits, meaning this attracts water-molecules to plump and hydrate the area. The flavonoids provide antioxidant protection from free radicals, as well as anti-inflammatory benefits, by modulating inflammatory responses within the body.","Marshmallow root extract is derived from the root of the marshmallow plant (Althaea officinalis). In skincare, it is used for its potential soothing, hydrating, and skin-conditioning properties.","Marshmallow root offers benefits such as:
- Provides excellent hydration and moisture retention, helping to keep the skin soft and supple.
- Assists in soothing and calming irritated or inflamed skin, making it beneficial for sensitive or reactive skin types.
- Can help alleviate dryness and discomfort associated with skin conditions like eczema and psoriasis.","[' ', 'Redness', ' ', 'Pregnancy']","[' ', 'Related Allergy']",https://renude.co/ingredients/marshmallow-root
Mineral UV Filters,,"Mineral UV filters are naturally-occurring mineral powders, used in sun protection products to absorb UV light. They work predominantly by absorbing UV rays, like their synthetic/chemical counterparts, with only about 5% of UV rays reflected. There are currently two mineral UV filters on the market: zinc oxide and titanium dioxide.","Mineral UV filters, also known as physical or inorganic UV filters, are naturally occurring mineral compounds used in sunscreens for their ability to provide broad-spectrum sun protection. The available mineral UV filters are Zinc Oxide and Titanium Dioxide.","Mineral UV filters offer benefits such as:
- Provide broad-spectrum protection against UVA and UVB rays, effectively shielding the skin from sunburn and premature aging.
- Form a protective layer on the skin's surface, preventing UV rays from penetrating into the deeper layers of the skin.","[' ', 'Anyone']","[' ', 'May leave a white cast on darker skin']",https://renude.co/ingredients/mineral-uv-filters
Meadowfoam Seed Oil,,"Meadowfoam seed oil is a luxurious and lightweight oil derived from the seeds of the meadowfoam plant (Limnanthes alba). In skincare, it is used for its excellent moisturizing, nourishing, and skin-protecting properties.","This is a lightweight plant oil which acts as an emollient in skincare. This means is supports the natural lipid-barrier, to help keep water from being lost through the skin. This make is an effective moisturising ingredient.","Meadowfoam seed oil offers benefits such as:
- Provides superior and long-lasting moisturization, helping to lock in moisture and prevent water loss from the skin.
- Nourishes and softens the skin, leaving it feeling smooth and velvety.
- Assists in forming a protective barrier on the skin's surface, shielding it from environmental stressors and pollutants.
- Supports overall skin health, promoting a more radiant and healthy complexion.","[' ', 'Dry and dehydrated skin', ' ', 'Radiance', ' ', 'Pregnancy', ' ', 'Texture']","[' ', 'Related Allergy']",https://renude.co/ingredients/meadowfoam-seed-oil
Marine Extract,,"Rich in essential ions like Zinc and Copper, marine extracts natural ingredients perfectly enhance skincare formulations. Almost every marine extract is an excellent source of antioxidants, protecting the skin from harmful external factors like UV-induced damage or oxidative stress. 

It is in the class of Algae Extract which also include ahnfeltia concinna extract, alaria esculenta extract, algae exopolysaccharides, algin, alteromonas ferment extract, alteromonas ferment extract, ascophyllum nodosum extract, asparagopsis armata extract, chlorella protothecoides, chlorella vulgaris extract, dunaliella salina (green algae) extract, hydrolyzed f-fucoidan, laminaria ochroleuca (kelp) extract, and macrocystis pyrifera (kelp) extract.","Marine extracts act as humectants in the skin, revealing a supple, smooth, and youthful surface.","Marine extract has anti-aging properties that will help achieve a radiant and smooth surface, and healthy appearance. ","[' ', 'Dry and dehydrated skin', ' ', 'Fine Lines', ' ', 'Pregnancy', ' ', 'Wrinkles']","[' ', 'Related Allergy']",https://renude.co/ingredients/marine-extract
Mango Seed Butter,,"Mango seed butter, also known as mango kernel butter or mango butter, is a rich and creamy emollient derived from the seeds of the mango fruit (Mangifera indica). In skincare, it is used for its excellent moisturizing, nourishing, and skin-conditioning properties.","Mango seed butter is an effective emollient in skincare. It has a rich, nourishing texture which helps to support the natural lipid barrier to prevent water loss and increase moisture in the skin.","Mango seed butter offers benefits such as:
- Provides deep and long-lasting moisturization, helping to restore and maintain the skin's natural barrier function.
- Nourishes and softens the skin, leaving it feeling smooth and supple.
- Assists in improving skin elasticity, making it beneficial for mature or dry skin.","[' ', 'Dry and dehydrated skin', ' ', 'Pregnancy']","[' ', 'Related Allergy']",https://renude.co/ingredients/mango-seed-butter
Palmitoyl Oligopeptide,,"Many peptides function as anti-ageing ingredients in skincare, due to their ability to fit specific receptors in the body to trigger anti-ageing responses. This includes mechanisms like collagen production, cell regeneration or even blocking muscle contractions to smooth expression lines. Peptides are made up of amino acids, and are unique in shape, with a huge variety available to target specific responses in the body.

It is from a class of ingredients also found on ingredients lists as acetyl hexapeptide, acetyl tetrapeptide, acetylarginyltryptophyl diphenylglycine, arginine/lysine polypeptide, azelaoyl bis-dipeptide, copper heptapeptide-14 pantothenate, dipeptide, dipeptide diaminobutyroyl benzylamide diacetate, ferric hexapeptide, heptapeptide-15, palmitate, myristol hexapeptide, myristol pentapeptide, myristoyl nonapeptide, myristoyl pentapeptide, oligopeptide, palmitoyl  tripeptide, palmitoyl decapeptide, palmitoyl heptapeptide, palmitoyl hexapeptide, palmitoyl nonapeptide, palmitoyl pentapeptide, palmitoyl tetrapeptide, palmitoyl tripeptide, palmitoyl tetrapeptide, pentapeptide, sh-oligopeptide, tetrapeptide and copper palmitoyl heptapeptide. 
 ","Many peptides function as anti-ageing ingredients in skincare, due to their ability to fit specific receptors in the body to trigger anti-ageing responses. This includes mechanisms like collagen production, cell regeneration or even blocking muscle contractions to smooth expression lines.","Used in skincare to treat fine lines, wrinkles and improve the skin's elasticity.","[' ', 'Elasticity', ' ', 'Fine Lines', ' ', 'Pregnancy', ' ', 'Wrinkles']","[' ', 'Related Allergy']",https://renude.co/ingredients/palmitoyl-oligopeptide
